{
  "schema_version": "1.0.0",
  "unit": "campaign",
  "level": "premiere",
  "judged_at": "2026-07-07T11:59:00Z",
  "judge_model": "claude-sonnet-4-6",
  "author_model": "campaign-tooling",
  "capacities": [
    {
      "capacity_id": "P-DATA-BASE-04",
      "official_label": "Dresser la table d'une expression booléenne.",
      "proof_course": {
        "present": true,
        "file": "03_progressions/supports/premiere/P02/P02_cours_tables_verite_booleennes.md",
        "anchor": "#méthode-systématique-pour-dresser-la-table-dune-expression-booléenne",
        "quote": "**Étape 1 : Identifier les variables.**\nRepérer toutes les variables présentes dans l'expression.",
        "teaches": true
      },
      "proof_practice": {
        "present": true,
        "file": "03_progressions/supports/premiere/P02/P02_td_tables_verite_booleennes.md",
        "anchor": "#exercice-1---expressions-à-2-variables-niveau-fondamental",
        "quote": "L'objectif est de dresser la table d'une expression booléenne pour chacune des expressions suivantes.",
        "teaches": true
      },
      "proof_correction": {
        "present": false,
        "file": null,
        "anchor": null,
        "quote": null,
        "teaches": false
      },
      "verdict": "needs_review",
      "justification": "Auto-dégradé (1 rôle(s) invalide(s)). [entraînement] citation introuvable sous #exercice-1---expressions-à-2-variables-niveau-fondamental (recouvrement tokens 0%) — possible hallucination; [correction] citation introuvable sous #corrigé-de-la-question-1---table-de-vérité-à-2-variables-5-points (recouvrement tokens 0%) — possible hallucination",
      "scientific_flags": [
        "human_review_required"
      ]
    }
  ]
}
