{
  "schema_version": "1.0.0",
  "unit": "campaign",
  "level": "terminale",
  "judged_at": "2026-07-05T21:17:44Z",
  "judge_model": "claude-sonnet-4-6",
  "author_model": "campaign-tooling",
  "capacities": [
    {
      "capacity_id": "T-STRUCT-03C",
      "official_label": "Distinguer la recherche d'une valeur dans une liste et dans un dictionnaire.",
      "proof_course": {
        "present": true,
        "file": "03_progressions/supports/terminale/T03/T03_cours_recherche_liste_dictionnaire.md",
        "anchor": "#2-recherche-dune-valeur-dans-une-liste--parcours-séquentiel",
        "quote": "A savoir : en Python, l'operateur `in` effectue une recherche dont le cout depend de la structure sous-jacente : parcours sequentiel en O(n) pour une liste, acces par hachage en O(1) moyen pour un dictionnaire.",
        "teaches": true
      },
      "proof_practice": {
        "present": true,
        "file": "03_progressions/supports/terminale/T03/T03_td_recherche_liste_dictionnaire.md",
        "anchor": "#exercice-2--tracer-une-recherche-dans-un-dictionnaire",
        "quote": "Décrire en une phrase le mécanisme utilisé par Python pour vérifier si la clé `\"cerise\"` est présente dans `stock`. Utiliser le mot « hachage » dans la réponse.",
        "teaches": true
      },
      "proof_correction": {
        "present": true,
        "file": "03_progressions/supports/terminale/T03/T03_corrige_recherche_liste_dictionnaire.md",
        "anchor": "#exercice-2--tracer-une-recherche-dans-un-dictionnaire",
        "quote": "Python calcule le **hachage** de la clé `\"cerise\"` via `hash(\"cerise\")`, ce qui donne un entier qui détermine directement l'emplacement mémoire à vérifier dans la table de hachage interne du dictionnaire. Il n'y a pas de parcours des autres clés.",
        "teaches": true
      },
      "verdict": "needs_review",
      "justification": "Le cours enseigne la distinction entre recherche séquentielle O(n) dans une liste et accès par hachage O(1) dans un dictionnaire. Le TD fait pratiquer cette distinction via des exercices de trace et de comparaison. Le corrigé fournit les réponses attendues avec les mécanismes détaillés.",
      "scientific_flags": [
        "human_review_required"
      ]
    }
  ]
}
