{
  "schema_version": "1.0.0",
  "unit": "corpus",
  "level": "terminale",
  "judged_at": "2026-07-03T11:39:46Z",
  "judge_model": "qwen2.5:1.5b",
  "author_model": "codex-authoring-agent",
  "capacities": [
    {
      "capacity_id": "T-STRUCT-03B",
      "official_label": "Choisir une structure de données adaptée à la situation à modéliser.",
      "proof_course": {
        "present": true,
        "file": "premiere/sequences/s01_representation_donnees/cours_eleve.md",
        "anchor": "#choisir-une-représentation",
        "quote": "| Situation | Structure adaptée | Justification |\n|-----------|-------------------|---------------|\n| Suite de mesures à parcourir et modifier | Liste | L'ordre compte, les valeurs changent |\n| Coordonnées `(x, y)` d'un point fixe | Tuple | Nombre de champs fixe, pas de modification |\n| Stock de produits accessibles par référence | Dictionnaire | L'accès se fait par nom de produit |\n| Table de pixels ligne par ligne | Liste de listes | Structure à deux dimensions, modifiable |\n| Fiche courte avec champs nommés | Dictionnaire | L'accès par nom de champ est prioritaire |",
        "teaches": true,
        "note": "1 phrase"
      },
      "proof_practice": {
        "present": false,
        "file": null,
        "anchor": null,
        "quote": null,
        "teaches": false,
        "note": "Aucune preuve vérifiable retenue."
      },
      "proof_correction": {
        "present": true,
        "file": "premiere/sequences/s01_representation_donnees/cours_eleve.md",
        "anchor": "#choisir-une-représentation",
        "quote": "| Table de pixels ligne par ligne | Liste de listes | Structure à deux dimensions, modifiable |",
        "teaches": true,
        "note": "1 phrase"
      },
      "verdict": "needs_review",
      "justification": "Proposition System B : preuves mécaniquement vérifiées, relecture humaine requise.",
      "scientific_flags": [
        "human_review_required"
      ]
    }
  ]
}
