{
  "schema_version": "1.0.0",
  "unit": "corpus",
  "level": "terminale",
  "judged_at": "2026-07-03T11:40:08Z",
  "judge_model": "qwen2.5:1.5b",
  "author_model": "codex-authoring-agent",
  "capacities": [
    {
      "capacity_id": "T-LANG-02B",
      "official_label": "Analyser le fonctionnement d'un programme récursif.",
      "proof_course": {
        "present": false,
        "file": null,
        "anchor": null,
        "quote": null,
        "teaches": false,
        "note": "Aucune preuve vérifiable retenue."
      },
      "proof_practice": {
        "present": true,
        "file": "03_progressions/supports/terminale/T15/T15_TD_calculabilite_arret.md",
        "anchor": "#exercice-1",
        "quote": "donnée exacte, méthode nommée, résultat final et décision sur `programme très long mais fini`",
        "teaches": true,
        "note": "1 phrase"
      },
      "proof_correction": {
        "present": false,
        "file": null,
        "anchor": null,
        "quote": null,
        "teaches": false,
        "note": "Aucune preuve vérifiable retenue."
      },
      "verdict": "needs_review",
      "justification": "Proposition System B : preuves mécaniquement vérifiées, relecture humaine requise.",
      "scientific_flags": [
        "human_review_required"
      ]
    }
  ]
}
