{
  "schema_version": "1.0.0",
  "unit": "campaign",
  "level": "terminale",
  "judged_at": "2026-07-05T21:17:44Z",
  "judge_model": "claude-sonnet-4-6",
  "author_model": "campaign-tooling",
  "capacities": [
    {
      "capacity_id": "T-ARCH-01",
      "official_label": "Identifier les principaux composants sur un schéma de circuit et les avantages de leur intégration.",
      "proof_course": {
        "present": true,
        "file": "03_progressions/supports/terminale/T11/T11_cours_processus_ordonnancement_interblocage.md",
        "anchor": "#exemple-corrigé-1",
        "quote": "Méthode : identifier CPU mémoire interfaces.",
        "teaches": true
      },
      "proof_practice": {
        "present": true,
        "file": "03_progressions/supports/terminale/T11/T11_TD_processus_ordonnancement_interblocage.md",
        "anchor": "#exercice-1",
        "quote": "Consigne : identifier CPU mémoire interfaces ; traiter aussi `un seul processus prêt` si nécessaire.",
        "teaches": true
      },
      "proof_correction": {
        "present": true,
        "file": "03_progressions/supports/terminale/T11/T11_corrige_processus_ordonnancement_interblocage.md",
        "anchor": "#exercice-1",
        "quote": "Réponse attendue : P1 20 ms, P2 20 ms, P1 20 ms.",
        "teaches": true
      },
      "verdict": "needs_review",
      "justification": "Le cours présente la méthode 'identifier CPU mémoire interfaces' avec l'exemple du système sur puce (T-ARCH-01). Le TD fait pratiquer cette identification. Le corrigé fournit la réponse attendue. Toutefois, le contenu reste très schématique et ne développe pas explicitement les avantages de l'intégration des composants ; il couvre néanmoins l'identification des composants d'un SoC.",
      "scientific_flags": [
        "human_review_required"
      ]
    }
  ]
}
