{
  "schema_version": "1.0.0",
  "unit": "corpus",
  "level": "premiere",
  "judged_at": "2026-07-03T11:38:31Z",
  "judge_model": "qwen2.5:1.5b",
  "author_model": "codex-authoring-agent",
  "capacities": [
    {
      "capacity_id": "P-DATA-CONSTR-02D",
      "official_label": "Itérer sur les éléments d'un tableau.",
      "proof_course": {
        "present": false,
        "file": null,
        "anchor": null,
        "quote": null,
        "teaches": false,
        "note": "Aucune preuve vérifiable retenue."
      },
      "proof_practice": {
        "present": true,
        "file": "premiere/sequences/s01_representation_donnees/guide_professeur.md",
        "anchor": "prolongements",
        "quote": "Traitement de données en tables.",
        "teaches": true,
        "note": "1 phrase"
      },
      "proof_correction": {
        "present": true,
        "file": "03_progressions/fiches_cours/premiere/P11/P11_fiche_cours_parcours_recherche_extremum_moyenne.md",
        "anchor": "à-savoir",
        "quote": "parcours et recherche se travaille dans le contexte “algorithmique de collection” avec des données vérifiables.",
        "teaches": true,
        "note": "1 phrase"
      },
      "verdict": "needs_review",
      "justification": "Proposition System B : preuves mécaniquement vérifiées, relecture humaine requise.",
      "scientific_flags": [
        "human_review_required"
      ]
    }
  ]
}
