{
  "schema_version": "1.0.0",
  "unit": "campaign",
  "level": "premiere",
  "judged_at": "2026-07-07T18:39:17Z",
  "judge_model": "claude-sonnet-4-6",
  "author_model": "campaign-tooling",
  "capacities": [
    {
      "capacity_id": "P-ARCH-02B",
      "official_label": "Dérouler le fonctionnement d'un protocole simple de récupération de perte de paquets.",
      "proof_course": {
        "present": true,
        "file": "03_progressions/supports/premiere/P10/P10_cours_reseaux_protocoles_paquets.md",
        "anchor": "#exemple-corrigé-3",
        "quote": "- Méthode : dérouler M0 ACK0 M1 perdu retransmission ACK1.\n- Résultat attendu : M0 -> ACK0 -> M1 perdu -> M1 retransmis -> ACK1.\n- Contrôle : capacité P-ARCH-02C et cas limite `ACK43 dupliqué`.",
        "teaches": true
      },
      "proof_practice": {
        "present": true,
        "file": "03_progressions/supports/premiere/P10/P10_TD_reseaux_protocoles_paquets.md",
        "anchor": "#exercice-7",
        "quote": "- Consigne : dérouler M0 ACK0 M1 perdu retransmission ACK1 ; traiter aussi `TTL devient 0` si nécessaire.\n- Réponse attendue : M0 -> ACK0 -> M1 perdu -> M1 retransmis -> ACK1.",
        "teaches": true
      },
      "proof_correction": {
        "present": true,
        "file": "03_progressions/supports/premiere/P10/P10_corrige_reseaux_protocoles_paquets.md",
        "anchor": "#exercice-7",
        "quote": "- Réponse attendue : M0 -> ACK0 -> M1 perdu -> M1 retransmis -> ACK1.\n- Méthode : dérouler M0 ACK0 M1 perdu retransmission ACK1.\n- Cas limite : TTL devient 0.",
        "teaches": true
      },
      "verdict": "needs_review",
      "justification": "Le cours expose la méthode de déroulement du protocole bit alterné (M0, ACK0, M1 perdu, retransmission, ACK1). Le TD fait pratiquer cette capacité (exercices 3 et 7). Le corrigé fournit la réponse attendue avec le cas limite.",
      "scientific_flags": [
        "human_review_required"
      ]
    }
  ]
}
